{
  "schema_version": 2,
  "kind": "tanager-rocks-video-release-contract",
  "status": "template",
  "release": {
    "id": null,
    "title": "The color you can't see",
    "repository_url": null,
    "archive_doi": null,
    "doi_evidence": {
      "role": "doi_evidence",
      "path": null,
      "sha256": null
    },
    "output_basename": "tanager-rocks-video",
    "bundle_name": null,
    "contract_locator": "video/manifests/release_contract.json"
  },
  "source": {
    "commit": null,
    "tag": null,
    "dirty": null
  },
  "rights": {
    "claims_frozen": null,
    "planet_material_reviewed": null,
    "elevenlabs_narration_reviewed": null,
    "elevenlabs_music_reviewed": null,
    "third_party_visuals_reviewed": null,
    "reviewer": null,
    "reviewed_at_utc": null,
    "attestation": null,
    "trust_root": "operator-attestation",
    "operator": null,
    "evidence_basis": "provider-account-and-generation-plan-records",
    "provider_account_evidence": "generation_records.tts+music.account_plan",
    "generation_plan_evidence": "video/build/music_v2_composition_plan.json",
    "legal_rights_statement": "operator attestation; code does not establish legal rights"
  },
  "distribution": {
    "include_media_masters": null,
    "master_asset_uri": null
  },
  "generation_records": {
    "tts": {
      "role": "generation_record",
      "path": null,
      "sha256": null
    },
    "music": {
      "role": "generation_record",
      "path": null,
      "sha256": null
    }
  },
  "audio": {
    "segments": {
      "00_title": "video/audio_v2/00_title_426.mp3",
      "01_hook": "video/audio_v2/01_hook.mp3",
      "02_stakes": "video/audio_v2/02_stakes.mp3",
      "03_data": "video/audio_v2/03_data_426.mp3",
      "04_ablation": "video/audio_v2/04_ablation.mp3",
      "05_livemap": "video/audio_v2/05_livemap.mp3",
      "06_validation": "video/audio_v2/06_validation.mp3",
      "07_amd": "video/audio_v2/07_amd.mp3",
      "08_close": "video/audio_v2/08_close_take3.mp3"
    },
    "music_bed": "video/audio_v2/music_bed_v2a.mp3"
  },
  "beats": {
    "00": {
      "tier": "designed",
      "asset_path": "video/build/motif.mp4"
    },
    "01": {
      "tier": "designed",
      "asset_path": null
    },
    "02": {
      "tier": "designed",
      "asset_path": null
    },
    "03": {
      "tier": "upgrade",
      "asset_path": "video/build/v2/upgrades/03.mp4"
    },
    "04": {
      "tier": "upgrade",
      "asset_path": "video/build/v2/upgrades/04.mp4"
    },
    "05": {
      "tier": "tanager-still",
      "asset_path": "video/build/v2/fallback_05.png"
    },
    "06a": {
      "tier": "designed",
      "asset_path": null
    },
    "06b": {
      "tier": "fallback",
      "asset_path": null
    },
    "07": {
      "tier": "tanager-still",
      "asset_path": "video/build/v2/fallback_07.png"
    },
    "08": {
      "tier": "designed",
      "asset_path": null
    }
  },
  "inputs": [
    {
      "role": "figure",
      "path": "submission/figures/bingham_20250911_191523_58_4001_amd_agp.png",
      "sha256": null
    },
    {
      "role": "figure",
      "path": "submission/figures/bingham_20250911_191523_58_4001_band_ablation.png",
      "sha256": null
    },
    {
      "role": "figure",
      "path": "submission/figures/bingham_rgb.png",
      "sha256": null
    },
    {
      "role": "figure",
      "path": "submission/figures/goldfield_20240925_185504_87_4001_emit_comparison.png",
      "sha256": null
    },
    {
      "role": "figure",
      "path": "submission/figures/goldfield_20240925_185504_87_4001_hero_mineral_map.png",
      "sha256": null
    },
    {
      "role": "figure",
      "path": "submission/figures/goldfield_rgb.png",
      "sha256": null
    },
    {
      "role": "figure",
      "path": "submission/figures/goldfield_spectra.png",
      "sha256": null
    },
    {
      "role": "figure",
      "path": "submission/figures/goldfield_validation_pair.png",
      "sha256": null
    },
    {
      "role": "narration_text",
      "path": "video/narration_script_v2.md",
      "sha256": null
    },
    {
      "role": "narration_text",
      "path": "video/segments_v2/00_title.txt",
      "sha256": null
    },
    {
      "role": "narration_text",
      "path": "video/segments_v2/01_hook.txt",
      "sha256": null
    },
    {
      "role": "narration_text",
      "path": "video/segments_v2/02_stakes.txt",
      "sha256": null
    },
    {
      "role": "narration_text",
      "path": "video/segments_v2/03_data.txt",
      "sha256": null
    },
    {
      "role": "narration_text",
      "path": "video/segments_v2/04_ablation.txt",
      "sha256": null
    },
    {
      "role": "narration_text",
      "path": "video/segments_v2/05_livemap.txt",
      "sha256": null
    },
    {
      "role": "narration_text",
      "path": "video/segments_v2/06_validation.txt",
      "sha256": null
    },
    {
      "role": "narration_text",
      "path": "video/segments_v2/07_amd.txt",
      "sha256": null
    },
    {
      "role": "narration_text",
      "path": "video/segments_v2/08_close.txt",
      "sha256": null
    },
    {
      "role": "narration_audio",
      "path": "video/audio_v2/00_title_426.mp3",
      "sha256": null
    },
    {
      "role": "narration_audio",
      "path": "video/audio_v2/01_hook.mp3",
      "sha256": null
    },
    {
      "role": "narration_audio",
      "path": "video/audio_v2/02_stakes.mp3",
      "sha256": null
    },
    {
      "role": "narration_audio",
      "path": "video/audio_v2/03_data_426.mp3",
      "sha256": null
    },
    {
      "role": "narration_audio",
      "path": "video/audio_v2/04_ablation.mp3",
      "sha256": null
    },
    {
      "role": "narration_audio",
      "path": "video/audio_v2/05_livemap.mp3",
      "sha256": null
    },
    {
      "role": "narration_audio",
      "path": "video/audio_v2/06_validation.mp3",
      "sha256": null
    },
    {
      "role": "narration_audio",
      "path": "video/audio_v2/07_amd.mp3",
      "sha256": null
    },
    {
      "role": "narration_audio",
      "path": "video/audio_v2/08_close_take3.mp3",
      "sha256": null
    },
    {
      "role": "music",
      "path": "video/audio_v2/music_bed_v2a.mp3",
      "sha256": null
    },
    {
      "role": "music_plan",
      "path": "video/build/music_v2_composition_plan.json",
      "sha256": null
    },
    {
      "role": "terms_snapshot",
      "path": "video/manifests/evidence/elevenlabs-tts-terms.html",
      "sha256": null
    },
    {
      "role": "terms_snapshot",
      "path": "video/manifests/evidence/eleven-music-terms.html",
      "sha256": null
    },
    {
      "role": "beat_asset",
      "path": "video/build/motif.mp4",
      "sha256": null
    },
    {
      "role": "beat_asset",
      "path": "video/build/v2/upgrades/03.mp4",
      "sha256": null
    },
    {
      "role": "beat_asset",
      "path": "video/build/v2/upgrades/04.mp4",
      "sha256": null
    },
    {
      "role": "beat_asset",
      "path": "video/build/v2/fallback_05.png",
      "sha256": null
    },
    {
      "role": "beat_asset",
      "path": "video/build/v2/fallback_07.png",
      "sha256": null
    }
  ]
}
